productId,brandName,productName,price,discountRate,currentlyViewing,currentlyBuying,ranking,trending,colors,date,category
4505574,코드,프라스 콤피 카고 팬츠_CAMOUFLAGE,170100,10,0,0,221,0,,2024120120,pants
4298720,엑스톤즈,XP234 리온 와이드 코튼 팬츠 (BLACK),62300,30,58,0,222,0,black,2024120120,pants
4371816,우마뭉,Pure saxon wool tucked pant_Graphite,168000,20,0,0,223,0,,2024120120,pants
4507580,인템포무드,쿼드 라인 데님 팬츠_블루,81600,15,10,0,224,0,블루,2024120120,pants
4269852,유니폼브릿지,cotton fatigue pants wide fit black,55300,30,11,0,225,0,black,2024120120,pants
4628463,카키포인트,Lace Track Pants (black),80750,5,17,0,226,0,black,2024120120,pants
4586412,칙스,슬림 융기모 부츠컷 차콜그레이,31900,35,24,0,227,0,그레이 | 차콜,2024120120,pants
4336575,엑스컨테이너,더블니 카펜터 가먼트 다잉 팬츠 (BROWN),39000,40,42,0,228,0,brown,2024120120,pants
4514482,트릴리온,벨벳 인버티드 턱 와이드 팬츠 [블랙],39000,22,23,0,229,0,블랙,2024120120,pants
4274063,리메인세컨드,와이드 빅포켓 파라슈트 밴딩 카고 팬츠 [베이지],27900,17,11,0,230,0,,2024120120,pants
4579828,다이닛,DEINET BACK LOGO SWEAT PANTS IN CHARCOAL,159600,5,10,0,231,0,charcoal,2024120120,pants
4270337,리바이스,555™ 릴렉스 스트레이트 진_000LO-0003,159000,0,0,0,232,0,,2024120120,pants
4338352,리바이스,립케이지 와이드 레그 진_A6081-0019,159000,0,0,0,233,0,,2024120120,pants
4602373,언더오프,융기모 히트 루즈핏 워싱 데님 그레이,29900,35,17,0,234,0,그레이,2024120120,pants
4511858,시그니처,울 라이크 노턱 와이드핏 슬랙스[블랙],37900,36,19,0,235,0,블랙,2024120120,pants
4614122,브렌슨,B. 코듀로이 니트 원턱 와이드팬츠,29800,20,37,0,236,0,,2024120120,pants
4352419,무신사 스탠다드,브러쉬드 원 턱 와이드 밴딩 슬랙스 [블랙],51090,20,23,0,237,0,블랙,2024120120,pants
4293038,더콜디스트모먼트,TCM starfish chino pants (charcoal),92650,15,125,0,238,0,charcoal,2024120120,pants
4210129,무신사 스탠다드,시티 워커스 테이퍼드 코튼 팬츠 [베이지],37290,15,40,0,239,0,,2024120120,pants
4311945,세터,테오 코튼 밴딩 스웨트팬츠 팔레트 블랙,76450,45,41,0,240,0,블랙,2024120120,pants
4338994,후드후드,HD 에일리언 멀티 자수 데님 팬츠 블랙,76300,30,18,0,241,0,블랙,2024120120,pants
4616036,트리밍버드,Stone Washing Vertical Logo Sweat Pants [ Black ],198000,0,0,0,242,0,black,2024120120,pants
4314665,와르,[-6cm 숏버전 추가] M233 더블캣 와이드팬츠_진청,49900,61,12,0,243,0,,2024120120,pants
4609746,미학,메탈 로고 스웻팬츠 (PIGMENT),49600,20,28,0,244,0,,2024120120,pants
4382322,제이엘브,원턱 헤비코튼 라인 와이드 팬츠,49000,42,25,0,245,0,,2024120120,pants
4459086,젠사이,리버스 딥 턱 슬랙스 블랙,151200,37,0,0,246,0,블랙,2024120120,pants
4459136,젠사이,울 블랜드 와이드 플라이 슬랙스 그린,151200,37,0,0,247,0,그린,2024120120,pants
4471860,어게인스트 올 오즈,워시드 빈티지 와이드 벌룬 데님 팬츠 [더스트 블랙],24200,56,52,0,248,0,블랙,2024120120,pants
4569725,아디다스,3S 우븐 파라슈트 팬츠 - 블랙 / IY7251,73990,25,10,0,249,0,블랙,2024120120,pants
4289804,글로니,THE JANE JEANS (BLUE),123250,15,11,0,250,0,blue,2024120120,pants
4593619,아디다스,배기 핏 파이어버드 트랙 팬츠 - 브라운 / IZ2476,88990,25,16,0,251,0,브라운,2024120120,pants
4604854,놈브레,플레어 스웻 팬츠 [블랙],23200,55,0,0,252,0,블랙,2024120120,pants
4331143,디스커버리 익스페디션,남성 기모 테이퍼드 카고조거팬츠 (BLACK),149000,0,0,0,253,0,black,2024120120,pants
4391906,스파오,[프렌치테리] 와이드 스웨트팬츠(기모)_SPMTE4TG02,26900,10,35,0,254,0,,2024120120,pants
4514512,트릴리온,울 라이크 인버티드 턱 와이드 팬츠 [블랙],45450,20,22,0,255,0,블랙,2024120120,pants
4520117,아티드,셀비 기모 데님 팬츠_INDIGO,71400,40,0,0,256,0,,2024120120,pants
4432613,칙스,다이닝 벌룬 와이드 코듀로이 팬츠 Brown,34500,27,190,0,257,0,brown,2024120120,pants
4210181,무신사 스탠다드,빅 브러쉬 와이드 코듀로이 팬츠 [러스티 다크 그레이],48290,15,26,0,258,0,그레이,2024120120,pants
4302299,위캔더스,APPLE DENIM PANTS (BLACK),85140,34,33,0,259,0,black,2024120120,pants
4352394,무신사 스탠다드,피그먼트 카고 스웨트 팬츠 [차콜 그레이],46390,25,17,0,260,0,그레이 | 차콜,2024120120,pants
4309346,어널러코드,엠보워싱 데님팬츠 (흑청),34200,40,49,0,261,0,,2024120120,pants
4270188,스톤아일랜드,수피마 코튼 와펜 테이퍼트핏 팬츠 - 블랙 / 811530410V0029,380990,41,20,0,262,0,블랙,2024120120,pants
4296119,노운,corduroy denim pants (light blue),117300,15,28,0,263,0,blue,2024120120,pants
4447570,아디다스,BB 트랙 팬츠 - 라이트그레이:그린 / JD5262,64990,40,86,0,264,0,그린 | 그레이,2024120120,pants
4537126,로우클래식,BRUSHED FLEECE WIDE-LEG JEANS_MID BLUE_LC244PT14MB,141550,5,0,0,265,0,blue,2024120120,pants
4435705,코닥,씨네코닥 오버핏 코듀로이 조거 팬츠 MELANGE GREY,141550,5,0,0,266,0,grey,2024120120,pants
4435706,코닥,씨네코닥 오버핏 코듀로이 조거 팬츠 BLACK,141550,5,0,0,267,0,black,2024120120,pants
4308186,디미트리블랙,VLAD 원턱 피그먼트 페이드 워싱 스웻 팬츠_네이비,33800,28,136,0,268,0,네이비,2024120120,pants
4308257,언탭트 스튜디오,YKK 더블 투턱 와이드 슬랙스 3Color,34870,30,76,0,269,0,,2024120120,pants
4410045,브라운야드,"소프트 스웻 팬츠, 라이트 브라운",140600,5,0,0,270,0,브라운,2024120120,pants
4448561,글로니,PROVINCE EYELET PANTS (NIGHT BOUQUET),66500,30,11,0,271,0,,2024120120,pants
4467149,브렌슨,B. 스트링 카고 와이드 벌룬 핏 스웨트 팬츠 ( 3Color ),42800,20,25,0,272,0,,2024120120,pants
4284713,코프위,[현킴 X 코프위]시밀롱 데님 팬츠 틴 브라운,43200,20,11,0,273,0,브라운,2024120120,pants
4475804,아옵트,TWO-TUCK WIDE DENIM PANTS - CREAM,137700,10,0,0,274,0,,2024120120,pants
4210175,무신사 스탠다드,나일론 원 턱 파라슈트 카고 팬츠 [블랙],45490,20,15,0,275,0,블랙,2024120120,pants
4369747,에스피오나지,Cliff Relaxed Denim Pants Black,81600,15,16,0,276,0,black,2024120120,pants
4535845,터틀백,TBK 나일론 삥줄 스트링 팬츠 (블랙),44100,10,23,0,277,0,블랙,2024120120,pants
4328518,트릴리온,울 인버티드 턱 헤링본 와이드 팬츠 (GRAY),42300,26,27,0,278,0,,2024120120,pants
4359310,포르타,"DOUBLE CURVED DENIM PANTS, DARK GREY",135200,20,0,0,279,0,grey,2024120120,pants
4355580,스컬프터,Boucle Micro Shorts Flag,65660,33,20,0,280,0,,2024120120,pants
4536874,필루미네이트,핀 턱 테이핑 트레이닝 팬츠-네이비,32990,43,55,0,281,0,네이비,2024120120,pants
4583773,다이브인,WASHED CURVED CHINO PANTS (BLACK),109000,0,15,0,282,0,black,2024120120,pants
4230727,무신사 스탠다드 우먼,[힛탠다드] 우먼즈 속기모 부츠 컷 데님 팬츠 [워시드 블랙],40390,25,25,0,283,0,블랙,2024120120,pants
4312894,폴로 랄프 로렌,빅핏 디스트레스트 치노 팬츠-베이지/카키,349000,0,11,0,284,0,,2024120120,pants
4461195,펜필드,[TRAILWEAR] HERRINGBONE TWO PLEATED TROUSERS DARK BROWN_FQ4WP01U,167300,30,11,0,285,0,brown,2024120120,pants
4210144,무신사 스탠다드,시티 레저 벨티드 멀티 포켓 카고 팬츠 [블랙],63890,20,23,0,286,0,블랙,2024120120,pants
4269903,무신사 스탠다드 우먼,우먼즈 데님 와이드 카펜터 팬츠 [미디엄 인디고],41890,30,15,0,287,0,,2024120120,pants
4487831,엑스톤즈,XP257 와이드 데님 퀼팅 패딩 팬츠 (DARK BLUE),76800,40,23,0,288,0,blue,2024120120,pants
4537034,웬즈데이오아시스,올웨이즈 투웨이 스트링 울 니트 팬츠 3COLOR,63600,40,45,0,289,0,,2024120120,pants
4353857,비엘알,Embossed Wave Washing Wide Denim Pants Black,127200,20,11,0,290,0,black,2024120120,pants
4281019,애프터프레이,크루저 릴렉스드 워시드 진스 라이트 인디고,127200,20,0,0,291,0,,2024120120,pants
4316434,비긴202,Ponte Mixed Color Track Pants,104250,25,29,0,292,0,,2024120120,pants
4386110,세터,로턴 벨루어 트랙 팬츠 블랙,126750,25,14,0,293,0,블랙,2024120120,pants
4300477,데케트,Curved Wide Jeans DCPT033CPBlack2,27900,55,132,0,294,0,black,2024120120,pants
4417674,필루미네이트,오버랩 스웨트 팬츠-오트밀,24500,55,42,0,295,0,,2024120120,pants
4342052,엑스컨테이너,빈티지 워시드 와이드 데님 팬츠 (DEEP INDIGO),29900,46,57,0,296,0,,2024120120,pants
4430404,필루미네이트,FLM 리버스 스웨트 팬츠-블랙,40190,31,0,0,297,0,블랙,2024120120,pants
4323232,알리스,[오정규X알리스] 패널드 카펜터 와이드 팬츠 [빈티지블랙],73500,25,22,0,298,0,블랙,2024120120,pants
4585824,가까이 유니언즈,절개 피그먼트 와이드 스웨트팬츠 브라운,39900,36,14,0,299,0,브라운,2024120120,pants
4274049,리메인세컨드,빈티지 캣워싱 와이드 데님 팬츠 [옐로우 워싱],24800,43,1300,168,1,0,,2024120213,pants
4308187,디미트리블랙,[기모선택] VLAD 원턱 피그먼트 페이드 워싱 스웻 팬츠_블랙,23900,49,599,110,2,1,블랙,2024120213,pants
4556448,스켈리웩,기모 벌룬핏 스웨트 팬츠[브라운],29900,49,1900,82,3,0,브라운,2024120213,pants
4293047,더콜디스트모먼트,TCM starfish chino pants (brown),92650,15,369,32,4,0,brown,2024120213,pants
4319523,토피,카펜터 퍼티그 워크 코튼 팬츠 (SAND GREY),29500,50,314,47,5,0,grey,2024120213,pants
4293032,더콜디스트모먼트,TCM starfish chino pants (black),92650,15,226,0,6,0,black,2024120213,pants
4316816,비긴202,Hand Painting Track Pants,90300,30,52,0,7,0,,2024120213,pants
4358823,브랜디드,1792 OLD SOUL JEANS [WIDE STRAIGHT],66950,35,146,0,8,0,,2024120213,pants
4431870,오피쉬,"와이드 레오파드 팬츠, 챠콜",58860,46,315,0,9,0,,2024120213,pants
4543780,오로,[기모Ver] 클래식 코듀로이 팬츠_6Color,41900,51,412,0,10,0,,2024120213,pants
4274045,리메인세컨드,빈티지 캣워싱 와이드 데님 팬츠 [샌드 블루],34800,20,338,0,11,0,블루,2024120213,pants
4471064,브렌슨,(Renew Ver.) 투턱 와이드 스웨트 팬츠 ( 4Color ) ( 기모선택 ),23900,42,315,80,12,1,,2024120213,pants
4556622,스켈리웩,이지 코듀로이 와이드 팬츠[웜터프],29900,49,1300,30,13,0,,2024120213,pants
4539005,바운더리,(기모) 투턱 와이드 롱 스웨트 팬츠 2color,29900,77,203,39,14,0,,2024120213,pants
4323231,알리스,[오정규X알리스] 패널드 카펜터 와이드 팬츠 [블랙],57820,41,114,0,15,0,블랙,2024120213,pants
4308206,디미트리블랙,VLAD 라운드 슬래쉬 데님 팬츠_더스트 인디고,22900,49,266,39,16,0,,2024120213,pants
4360670,리트리버클럽,LIL DEVIL DENIM [INDIGO BLACK],43120,56,320,0,17,0,black,2024120213,pants
4524021,오버듀플레어,OF WARM JOGGER PANTS_BABY PINK,119000,0,15,0,18,0,,2024120213,pants
4556449,스켈리웩,기모 벌룬핏 스웨트 팬츠[라이트그레이],34900,41,380,32,19,0,그레이,2024120213,pants
4322895,스컬프터,Beaded Waist Denim Pants Indigo Blue,167200,20,34,0,20,0,blue,2024120213,pants
4556222,시그니처,더블니 기모 트레이닝 팬츠[멜란지그레이],24900,58,163,0,21,0,그레이,2024120213,pants
4229168,무신사 스탠다드 우먼,[힛탠다드] 우먼즈 헤비웨이트 속기모 딥 턱 와이드 슬랙스 [블랙],29890,40,851,0,22,1,블랙,2024120213,pants
4319249,토피,소프트 플리스 스트링 팬츠 (BLACK),21450,45,108,0,23,1,black,2024120213,pants
4354890,애즈온,SMOG WIDE PANTS / BLACK,85000,0,36,0,24,0,black,2024120213,pants
4293708,수아레,울 블렌드 원 턱 슬랙스 - 3 COLOR,47900,36,107,0,25,0,,2024120213,pants
4323440,무신사 스탠다드,시티 레저 어니언 패딩 벨티드 카고 팬츠 [블랙],71890,20,25,0,26,0,블랙,2024120213,pants
4441071,고요웨어,코듀라 써멀 팬츠 (블랙),167320,11,33,0,27,0,블랙,2024120213,pants
4316187,비긴202,Nycoma Two Tuck Pants V3 [Black],111200,20,15,0,28,0,black,2024120213,pants
4308176,디미트리블랙,바이오워싱 와이드 카펜터 데님 팬츠_더스트블랙,21900,51,160,0,29,0,블랙,2024120213,pants
4116855,톰브라운,백 RWB 턴업 앵클 팬츠 - 네이비 / MTC162E04502415,537490,71,20,0,30,0,네이비,2024120213,pants
4556433,스켈리웩,폴라폴리스 라인 트레이닝 팬츠[그레이],43000,27,189,30,31,0,그레이,2024120213,pants
4266754,필루미네이트,핀 턱 테이핑 트레이닝 팬츠-블랙,29900,48,157,0,32,0,블랙,2024120213,pants
4274042,리메인세컨드,빈티지 캣워싱 와이드 데님 팬츠 [다크 블루],34800,20,174,0,33,0,블루,2024120213,pants
4300655,데케트,Balloon Wide Jeans DCPT055Black,37200,40,137,0,34,0,black,2024120213,pants
4336570,엑스컨테이너,딥 워싱 와이드 데님 팬츠 (WASHED BLACK),27500,50,344,52,35,0,black,2024120213,pants
4594279,파히섬,스트라이프 슬림 밴딩팬츠_블랙,48300,30,76,0,36,0,블랙,2024120213,pants
4309321,어널러코드,엠보워싱 데님팬츠 (진청),28500,50,277,34,37,0,,2024120213,pants
4483981,나이키,스포츠웨어 스우시 오픈 헴 플리스 팬츠 M - 블랙:화이트 / FN3343-010,135000,0,47,0,38,0,블랙 | 화이트,2024120213,pants
4467373,브렌슨,B. 스트링 와이드 벌룬 핏 스웨트 팬츠 ( 5Color ),36800,20,104,0,39,0,,2024120213,pants
4229170,무신사 스탠다드 우먼,[힛탠다드] 우먼즈 헤비웨이트 속기모 딥 턱 와이드 슬랙스 [차콜 그레이],42390,15,108,0,40,0,그레이 | 차콜,2024120213,pants
4556447,스켈리웩,기모 벌룬핏 스웨트 팬츠[블랙],34900,41,279,0,41,0,블랙,2024120213,pants
4417675,필루미네이트,오버랩 스웨트 팬츠-멜란지그레이,24500,55,282,0,42,0,그레이,2024120213,pants
4536559,언탭트 스튜디오,원턱 와이드 코듀로이 밴딩 팬츠 3Color,29580,30,162,0,43,0,,2024120213,pants
4581831,셀렙샵에디션,[2pack] 24FW 마스터핏 기모 데님,67915,15,10,0,44,0,,2024120213,pants
4579922,이에이,[이에이 X 짱구대디] ANGLE CARGO PANTS 2Color,69000,59,55,0,45,0,,2024120213,pants
4380246,모이프,[AW24]UNIFORM PANTS / CHARCOAL NC,198000,0,0,0,46,0,charcoal,2024120213,pants
4342152,엑스컨테이너,원턱 와이드 코듀로이 팬츠 (BROWN),33000,40,225,31,47,0,brown,2024120213,pants
4522309,더엣지,[3pack] 24FW 코듀로이 와이드 팬츠,76415,15,10,0,48,0,,2024120213,pants
4544914,칙스,테린 코듀로이 융기모 팬츠,25500,48,370,32,49,0,,2024120213,pants
4298720,엑스톤즈,XP234 리온 와이드 코튼 팬츠 (BLACK),62300,30,53,0,50,0,black,2024120213,pants
4398163,에스피오나지,Selvedge Relaxed Denim Pants Dark Indigo,92800,20,91,0,51,0,,2024120213,pants
4283718,언탭트 스튜디오,딥 원턱 와이드 롱 스웨트 트레이닝 팬츠 2 COLOR,24860,30,91,0,52,0,,2024120213,pants
4300665,데케트,Balloon Wide Jeans DCPT055YLBlackB,37100,40,117,0,53,0,black,2024120213,pants
4481761,론론,BACK HEART STITCH POCKET SWEAT JOGGER PANTS CREAM YELLOW,69300,30,130,0,54,0,,2024120213,pants
4238718,튜드먼트,[잉화 착용]CLASSIC SABRINA PANTS BLACK,82800,24,13,0,55,0,black,2024120213,pants
4518143,아디다스,플리스 카고 팬츠 - 블랙 / IY9689,39990,49,27,0,56,0,블랙,2024120213,pants
4287648,무센트,(기모 선택) 코지 코듀로이 카고 와이드팬츠 남녀공용 (4컬러),39900,52,72,0,57,0,,2024120213,pants
4417677,필루미네이트,오버랩 스웨트 팬츠-블랙,24500,55,85,0,58,0,블랙,2024120213,pants
4475779,언노운 플라넷,[기모] 데일리 투턱 와이드 피그먼트 스웨트 팬츠 핑크,38600,48,793,0,59,0,,2024120213,pants
4383328,페이더먼트,[S~4XL] 피그먼트 절개 조거 팬츠,24000,60,87,0,60,0,,2024120213,pants
4525026,디키즈,폴라텍 플리스 더블니 팬츠 Black,101200,15,73,0,61,0,black,2024120213,pants
4387430,스노우피크 어패럴,라고 약기모 카고 조거 팬츠 Dark Gray (S24WMTPT34),151050,5,0,0,62,0,,2024120213,pants
4340490,엑스톤즈 우먼,WXP013 미야옹 핫픽스 데님 팬츠 (BLACK),59400,40,40,0,63,0,black,2024120213,pants
4548299,시그니처,원턱 코듀로이 와이드 팬츠[브라운],36000,35,83,0,64,0,브라운,2024120213,pants
4326417,무신사 스탠다드,시티 레저 폴라 플리스 벨티드 팬츠 [블랙],54290,15,48,0,65,0,블랙,2024120213,pants
4357953,스웨이드,BRUSH WASHED DENIM [NAVY],72250,15,0,0,66,0,navy,2024120213,pants
4343527,가까이 유니언즈,원턱 투 라인 와이드 스웨트팬츠 블랙,34900,30,42,0,67,0,블랙,2024120213,pants
4481757,론론,BACK HEART STITCH POCKET SWEAT JOGGER PANTS BLACK,69300,30,34,0,68,0,black,2024120213,pants
4341161,딥센스,워싱 벌룬 와이드 밴딩 데님 D627 - 4COLOR,38860,42,10,0,69,0,,2024120213,pants
4342800,고스트리퍼블릭,카펜터 와이드 데님팬츠 GLP-514,38700,34,41,0,70,0,,2024120213,pants
4347538,쿠어,신치 백 턴업 진스 (인디고),135000,10,20,0,71,0,,2024120213,pants
4382957,쿠어,더티 엠보 레귤러 워싱 진스 (라이트블루),135000,10,10,0,72,0,블루,2024120213,pants
4476122,언노운 플라넷,[기모] 데일리 투턱 와이드 피그먼트 스웨트 팬츠 챠콜,52300,30,298,0,73,0,,2024120213,pants
4322580,락케이크,96 Applique 2way Jogger - Black,65400,40,145,0,74,0,black,2024120213,pants
4396830,밀로 우먼,스트라이프 벌룬 진 [워시드 블랙],86400,20,19,0,75,0,블랙,2024120213,pants
4556221,시그니처,더블니 기모 트레이닝 팬츠[블랙],24900,58,125,0,76,0,블랙,2024120213,pants
4353830,비엘알,Spiral Line Raw-cut Washing Denim Pants,125000,30,0,0,77,0,,2024120213,pants
4543772,오로,[기모Ver] 클래식 코듀로이 팬츠_Espresso,59800,30,85,0,78,0,,2024120213,pants
4358873,브랜디드,51078 CONE ONYX JEANS [WIDE FLARE],82600,30,13,0,79,0,,2024120213,pants
4278901,엘무드,잔느 플레어 데님 프렌치 블루,121400,10,20,0,80,0,블루,2024120213,pants
4481772,론론,BACK HEART STITCH POCKET SWEAT JOGGER PANTS WHITE MELANGE,69300,30,24,0,81,0,white,2024120213,pants
4537123,로우클래식,BRUSHED FLEECE LOOSE-FIT JEANS_WHITE_LC244PT12WH,141550,5,15,0,82,0,white,2024120213,pants
4481890,데케트,[CALIK DENIM]Mid Rise Wide Jeans DCPT027PBlueB,59400,40,19,0,83,0,blue,2024120213,pants
4336573,엑스컨테이너,더블니 카펜터 가먼트 다잉 팬츠 (WASHED BLACK),39000,40,28,0,84,0,black,2024120213,pants
4409072,브랜디드,EXTRA WIDE DENIM PANTS [MEDIUM BLUE],58800,40,35,0,85,0,blue,2024120213,pants
4621914,오호스,i:e Fluid Fleece Pants 01 / Light Grey,116100,10,0,0,86,0,grey,2024120213,pants
4330060,드로우핏,에센셜 와이드 원턱 코듀로이 팬츠 [BLACK],48000,20,59,0,87,0,black,2024120213,pants
4252006,무신사 스탠다드 우먼,우먼즈 샤기 플리스 와이드 라운지 팬츠 [라이트 블루],31890,20,99,0,88,0,블루,2024120213,pants
4241658,언탭트 스튜디오,YKK 바이오워싱 와이드 카고 데님팬츠,36900,40,65,0,89,0,,2024120213,pants
4300670,데케트,Balloon Wide Jeans DCPT055YLBlueB,37100,40,66,0,90,0,blue,2024120213,pants
4533003,블랭크룸,울 트라우저_BROWN,218000,0,0,0,91,0,brown,2024120213,pants
4336575,엑스컨테이너,더블니 카펜터 가먼트 다잉 팬츠 (BROWN),35800,45,117,0,92,0,brown,2024120213,pants
4274077,리메인세컨드,원턱 와이드 코듀로이 밴딩 팬츠 [블랙],29800,24,40,0,93,0,블랙,2024120213,pants
4293038,더콜디스트모먼트,TCM starfish chino pants (charcoal),92650,15,70,0,94,0,charcoal,2024120213,pants
4502934,오와이,LEOPARD WIDE CARGO PANTS - LEOPARD,106520,30,14,0,95,0,,2024120213,pants
4415027,피아네르,맞주름 딥 와이드 스웨트 팬츠 (차콜),29900,49,32,0,96,0,차콜,2024120213,pants
4608708,음,여자 피치기모 사이드핀턱 트레이닝팬츠 4COLOR,29800,25,100,0,97,0,,2024120213,pants
4331951,유희,FLOWER PATTERN LAYERD SKIRT PANTS WHITE,129000,0,21,0,98,0,white,2024120213,pants
4278899,엘무드,잔느 플레어 데님 퓨어블랙,121500,10,11,0,99,0,블랙,2024120213,pants
4368612,무신사 스탠다드,피그먼트 와이드 데님 팬츠 [카키],50890,15,28,0,100,0,,2024120213,pants
4350957,미세키서울,Shirring bootscut pants CHARCOAL,183000,0,20,0,101,0,charcoal,2024120213,pants
4368868,프리즘웍스,FRENCH PARATROOPER SWEAT PANTS _ GRAY,102400,20,0,0,102,0,,2024120213,pants
4531765,퍼스트플로어,도슨 팬츠 (5가지 컬러),63600,42,54,0,103,0,,2024120213,pants
4383678,닉앤니콜,DOUBLE WAISTBAND SLACKS_CHARCOAL,102400,20,12,0,104,0,charcoal,2024120213,pants
4438457,앤더슨벨 포 우먼,데님 트롱프뢰유 레이어드 타잉 팬츠 apa768w(WASHED BLUE),360000,20,11,0,105,0,blue,2024120213,pants
4332686,스켈리웩,카모플라쥬 트레이닝 팬츠[그레이],39910,42,69,0,106,0,그레이,2024120213,pants
4365478,어프레쉬,에센셜 베이직 조거팬츠 2 COLOR,28100,40,17,0,107,0,,2024120213,pants
4454257,에피그램,코듀로이 써모 데일리 팬츠 ERPNW24401BRX,199000,0,0,0,108,0,,2024120213,pants
4290341,에피그램,블랙 워싱 벌룬핏 데님 ERPDW24221BKX,199000,0,0,0,109,0,블랙,2024120213,pants
4380247,모이프,[AW24]UNIFORM PANTS / BLACK NC,198000,0,16,0,110,0,black,2024120213,pants
4496173,아디다스,파라슈트 팬츠 - 블랙 / IY2075,64990,50,42,0,111,0,블랙,2024120213,pants
4419288,스튜디오니콜슨,피야드 데님 팬츠 - 블랙 / PYADSNM1246BLACK,192990,51,0,0,112,0,black | 블랙,2024120213,pants
4607550,토마스모어,플리스 팬츠-베이지,47500,0,40,0,113,0,,2024120213,pants
4394347,나이키,스포츠웨어 피닉스 플리스 하이웨이스트 와이드 레그 스웨트팬츠 W - 블랙:세일 / DQ5616-010,95000,0,26,0,114,0,블랙,2024120213,pants
4496182,아디다스,테디 플리스 트랙 팬츠 - 블랙 / IX5502,53990,45,39,0,115,0,블랙,2024120213,pants
4230822,나이키,조던 플라이트 플리스 팬츠 M - 블랙 / FV7251-010,94500,10,0,0,116,0,블랙,2024120213,pants
4322896,스컬프터,Beaded Waist Denim Pants Mid Blue,167200,20,25,0,117,0,blue,2024120213,pants
4443654,론론,CANCAN RUFFLE LAYERED PANTSKIRT BLACK,61600,30,16,0,118,0,black,2024120213,pants
4459607,칙스,루이스 스트레이트 데님 팬츠 Black denim,29900,40,44,0,119,0,black,2024120213,pants
4373554,메인부스,LAB.017 Balloon Denim Pants(INDIGO),89900,35,41,0,120,0,,2024120213,pants
4355092,말본 골프,말본 코듀라 조거 팬츠 NAVY (MAN),319000,0,0,0,121,0,navy,2024120213,pants
4417674,필루미네이트,오버랩 스웨트 팬츠-오트밀,24500,55,50,0,122,0,,2024120213,pants
4368565,무신사 스탠다드,브러쉬드 원 턱 와이드 밴딩 팬츠 [브라운],43090,20,55,0,123,0,브라운,2024120213,pants
4457420,아디다스,트랙 팬츠 - 브라운 / JD5263,86990,20,23,0,124,0,브라운,2024120213,pants
4252007,무신사 스탠다드 우먼,우먼즈 샤기 플리스 와이드 라운지 팬츠 [헤더 브라운],33890,15,55,0,125,0,브라운,2024120213,pants
4201721,니들스,옥스포드 클로스 필드 팬츠 - 블랙 / OT093BLACK,172040,66,0,0,126,0,black | 블랙,2024120213,pants
4614737,어나더 오피스,M-41 Weapon Slacks (Charcoal),151200,10,12,0,127,0,charcoal,2024120213,pants
4376192,오와이,LOGO EIGHT POCKET DENIM BAGGY PANTS - WASHED BLACK,98690,29,42,0,128,0,black,2024120213,pants
4525107,본투윈,CHROME B JOGGER PANTS [MELANGE GREY],84000,11,0,0,129,0,grey,2024120213,pants
4304152,아캄,Western Studded Cotton Pants (Black),167300,10,0,0,130,0,black,2024120213,pants
4556620,스켈리웩,이지 코듀로이 와이드 팬츠[블랙],39900,32,237,0,131,0,블랙,2024120213,pants
4163679,브렌우드,[브렌우드X포트너스] Two Tuck Wide Slacks,54500,50,14,0,132,0,,2024120213,pants
4507588,999휴머니티,AV 플리츠 데님 팬츠 (넵 빈티지 블루),163000,0,0,0,133,0,블루,2024120213,pants
4371048,프리터,Double Lace Track Pants 2Color_F243PT04,94800,40,23,0,134,0,,2024120213,pants
4399669,니어노어,ROSE BALLOON DENIM PANTS_INDIGO,118000,0,29,0,135,0,,2024120213,pants
4191479,디키즈,더블니 카펜터 데님 팬츠 Vintage Blue,94100,5,14,0,136,0,blue,2024120213,pants
4431865,오피쉬,"와이드 레오파드 팬츠, 브라운",69760,36,60,0,137,0,브라운,2024120213,pants
4422898,밀로 아카이브,리플렉트 커브드 팬츠 [브라운],68900,22,20,0,138,0,브라운,2024120213,pants
4444998,트래드클럽 빈티지,사이드 밴딩 크롭 기모 테이퍼드 슬랙스,39000,56,0,0,139,0,,2024120213,pants
4518001,세릭,WOOL WIDE BANDING PANTS / GRAY,158000,0,15,0,140,0,,2024120213,pants
4444768,아워 레가시,써드 컷 데님 팬츠 - 블랙 / M4245TR,278990,54,11,0,141,0,블랙,2024120213,pants
4483287,기철,CORD DUROY BALLOON PANTS (BROWN),53400,40,32,0,142,0,brown,2024120213,pants
4279895,노매뉴얼,A.P WORK PANTS - BLACK,76300,30,11,0,143,0,black,2024120213,pants
4544008,블랙야크,남성 튜브 다운팬츠_BK,153300,30,0,0,144,0,,2024120213,pants
4326503,무신사 스탠다드 우먼,우먼즈 와이드 랩 슬랙스 [블랙],36690,20,27,0,145,0,블랙,2024120213,pants
4495096,더엣지,[3pack] 24FW 링클프리 헤링본 기모 팬츠,76415,15,16,0,146,0,,2024120213,pants
4460296,지크립,핀턱 벌룬핏 와이드 데님팬츠,24900,54,20,0,147,0,,2024120213,pants
4556654,스켈리웩,코튼 스윙 벌룬핏 팬츠[브라운],42900,38,88,0,148,0,브라운,2024120213,pants
