productId,brandName,productName,price,discountRate,currentlyViewing,currentlyBuying,ranking,trending,colors,date,category
4274049,리메인세컨드,빈티지 캣워싱 와이드 데님 팬츠 [옐로우 워싱],24800,43,3400,440,1,0,,2024120120,pants
4556433,스켈리웩,폴라폴리스 라인 트레이닝 팬츠[그레이],34900,41,2200,187,2,1,그레이,2024120120,pants
4274045,리메인세컨드,빈티지 캣워싱 와이드 데님 팬츠 [샌드 블루],28200,35,1300,158,3,0,블루,2024120120,pants
4308187,디미트리블랙,[기모선택] VLAD 원턱 피그먼트 페이드 워싱 스웻 팬츠_블랙,23900,49,950,178,4,0,블랙,2024120120,pants
4293047,더콜디스트모먼트,TCM starfish chino pants (brown),92650,15,709,49,5,0,brown,2024120120,pants
4358823,브랜디드,1792 OLD SOUL JEANS [WIDE STRAIGHT],66950,35,481,65,6,0,,2024120120,pants
4319523,토피,카펜터 퍼티그 워크 코튼 팬츠 (SAND GREY),29500,50,633,92,7,1,grey,2024120120,pants
4274042,리메인세컨드,빈티지 캣워싱 와이드 데님 팬츠 [다크 블루],28200,35,794,80,8,1,블루,2024120120,pants
4342152,엑스컨테이너,원턱 와이드 코듀로이 팬츠 (BROWN),33000,40,605,89,9,1,brown,2024120120,pants
4381625,스켈리웩,스윙 벌룬핏 데님[블랙],47900,27,550,47,10,0,블랙,2024120120,pants
4360670,리트리버클럽,LIL DEVIL DENIM [INDIGO BLACK],43120,56,579,52,11,0,black,2024120120,pants
4431870,오피쉬,"와이드 레오파드 팬츠, 챠콜",58860,46,413,34,12,0,,2024120120,pants
4308176,디미트리블랙,바이오워싱 와이드 카펜터 데님 팬츠_더스트블랙,21900,51,494,83,13,0,블랙,2024120120,pants
4308206,디미트리블랙,VLAD 라운드 슬래쉬 데님 팬츠_더스트 인디고,22900,49,530,66,14,0,,2024120120,pants
4229168,무신사 스탠다드 우먼,[힛탠다드] 우먼즈 헤비웨이트 속기모 딥 턱 와이드 슬랙스 [블랙],29890,40,1000,70,15,0,블랙,2024120120,pants
4293032,더콜디스트모먼트,TCM starfish chino pants (black),92650,15,493,0,16,0,black,2024120120,pants
4300665,데케트,Balloon Wide Jeans DCPT055YLBlackB,37100,40,291,51,17,0,black,2024120120,pants
4309321,어널러코드,엠보워싱 데님팬츠 (진청),28500,50,522,53,18,0,,2024120120,pants
4336570,엑스컨테이너,딥 워싱 와이드 데님 팬츠 (WASHED BLACK),27500,50,841,121,19,0,black,2024120120,pants
4543780,오로,[기모Ver] 클래식 코듀로이 팬츠_6Color,41900,51,598,42,20,0,,2024120120,pants
4556222,시그니처,더블니 기모 트레이닝 팬츠[멜란지그레이],24900,58,436,54,21,0,그레이,2024120120,pants
4354890,애즈온,SMOG WIDE PANTS / BLACK,85000,0,209,0,22,0,black,2024120120,pants
4398163,에스피오나지,Selvedge Relaxed Denim Pants Dark Indigo,92800,20,271,54,23,0,,2024120120,pants
4539005,바운더리,(기모) 투턱 와이드 롱 스웨트 팬츠 2color,29900,77,403,55,24,0,,2024120120,pants
4556449,스켈리웩,기모 벌룬핏 스웨트 팬츠[라이트그레이],34900,41,299,31,25,0,그레이,2024120120,pants
4556447,스켈리웩,기모 벌룬핏 스웨트 팬츠[블랙],29900,49,290,51,26,1,블랙,2024120120,pants
4467373,브렌슨,B. 스트링 와이드 벌룬 핏 스웨트 팬츠 ( 5Color ),36800,20,339,72,27,0,,2024120120,pants
4300655,데케트,Balloon Wide Jeans DCPT055Black,37200,40,219,30,28,0,black,2024120120,pants
4544914,칙스,테린 코듀로이 융기모 팬츠,25500,48,852,57,29,0,,2024120120,pants
4293708,수아레,울 블렌드 원 턱 슬랙스 - 3 COLOR,47900,36,276,37,30,0,,2024120120,pants
4323231,알리스,[오정규X알리스] 패널드 카펜터 와이드 팬츠 [블랙],57820,41,176,0,31,0,블랙,2024120120,pants
4471064,브렌슨,(Renew Ver.) 투턱 와이드 스웨트 팬츠 ( 4Color ) ( 기모선택 ),23900,42,342,57,32,0,,2024120120,pants
4556432,스켈리웩,폴라폴리스 라인 트레이닝 팬츠[블랙],43000,27,407,30,33,0,블랙,2024120120,pants
4556448,스켈리웩,기모 벌룬핏 스웨트 팬츠[브라운],34900,41,368,0,34,0,브라운,2024120120,pants
4417675,필루미네이트,오버랩 스웨트 팬츠-멜란지그레이,24500,55,482,38,35,0,그레이,2024120120,pants
4328514,트릴리온,울 인버티드 턱 헤링본 와이드 팬츠 (BROWN),36900,35,144,0,36,0,brown,2024120120,pants
4352410,무신사 스탠다드,14W 코듀로이 원 턱 와이드 밴딩 팬츠 [블랙],43090,20,54,0,37,0,블랙,2024120120,pants
4266754,필루미네이트,핀 턱 테이핑 트레이닝 팬츠-블랙,29900,48,299,0,38,0,블랙,2024120120,pants
4548299,시그니처,원턱 코듀로이 와이드 팬츠[브라운],36000,35,111,0,39,0,브라운,2024120120,pants
4330060,드로우핏,에센셜 와이드 원턱 코듀로이 팬츠 [BLACK],48000,20,43,0,40,0,black,2024120120,pants
4483981,나이키,스포츠웨어 스우시 오픈 헴 플리스 팬츠 M - 블랙:화이트 / FN3343-010,135000,0,61,0,41,0,블랙 | 화이트,2024120120,pants
4531765,퍼스트플로어,도슨 팬츠 (5가지 컬러),76300,30,108,0,42,0,,2024120120,pants
4506373,아크시,루즈 워시드 벌룬핏 와이드 데님 팬츠 유니섹스 (블랙/블루),31920,20,124,0,43,0,블랙 | 블루,2024120120,pants
4284306,스톤아일랜드,올드 이펙트 트윌 브로큰 스트레치 와펜 레귤러핏 조거 팬츠 - 블랙 / 8115313L1A0129,379990,42,17,0,44,0,블랙,2024120120,pants
4417677,필루미네이트,오버랩 스웨트 팬츠-블랙,24500,55,173,37,45,0,블랙,2024120120,pants
4323440,무신사 스탠다드,시티 레저 어니언 패딩 벨티드 카고 팬츠 [블랙],71890,20,37,0,46,0,블랙,2024120120,pants
4556434,스켈리웩,폴라폴리스 라인 트레이닝 팬츠[블루],34900,41,270,0,47,0,블루,2024120120,pants
4096674,아워데이즈,[S사이즈 추가] 웨이비 커브드 와이드 데님 팬츠 [WHITE],37200,40,118,0,48,0,white,2024120120,pants
4578368,프렌치시크,컷팅라이트 밍크기모 와이드 절개 데님팬츠,52200,10,95,0,49,0,,2024120120,pants
4476184,언노운 플라넷,커스텀 원턱 와이드 코듀로이 팬츠 브라운,38600,48,234,0,50,0,브라운,2024120120,pants
4274082,리메인세컨드,원턱 와이드 코듀로이 밴딩 팬츠 [베이지],29800,24,119,0,51,0,,2024120120,pants
4274023,리메인세컨드,내추럴 워싱 와이드 데님 팬츠 [중청],26600,32,83,0,52,0,,2024120120,pants
4316816,비긴202,Hand Painting Track Pants,90300,30,97,0,53,0,,2024120120,pants
4340490,엑스톤즈 우먼,WXP013 미야옹 핫픽스 데님 팬츠 (BLACK),59400,40,69,0,54,0,black,2024120120,pants
4404236,리바이스,501® 오리지널 진_00501-1403,88500,1,10,0,55,0,,2024120120,pants
4504763,엔피스튜디오,사이드 턱 워싱 와이드 벌룬 팬츠 흑청,39800,55,57,0,56,0,,2024120120,pants
4319557,토피,페어리 와이드 데님 팬츠 (WASHED INDIGO),29400,40,131,0,57,0,,2024120120,pants
4300670,데케트,Balloon Wide Jeans DCPT055YLBlueB,37100,40,148,0,58,0,blue,2024120120,pants
4317583,알에스에스씨,INCISION JACQUARD MIXED PANTS - BLACK,143650,15,11,0,59,0,black,2024120120,pants
4309389,어널러코드,헤링본 도밍고 데님팬츠 (진청),39900,30,82,0,60,0,,2024120120,pants
4457420,아디다스,트랙 팬츠 - 브라운 / JD5263,86990,20,97,0,61,0,브라운,2024120120,pants
4376515,어반드레스,Accent Back String Pants BLACK,49200,40,73,0,62,0,black,2024120120,pants
4330245,코드그라피,카펜터 트레이닝 팬츠_차콜,39900,32,121,0,63,0,차콜,2024120120,pants
4544167,블랙몬스터핏,원턱 기모 와이드 트레이닝 팬츠 (Gray) / BM240509-1,25000,32,92,0,64,0,,2024120120,pants
4608708,음,여자 피치기모 사이드핀턱 트레이닝팬츠 4COLOR,29800,25,228,30,65,0,,2024120120,pants
4556654,스켈리웩,코튼 스윙 벌룬핏 팬츠[브라운],42900,38,147,0,66,0,브라운,2024120120,pants
4513304,발렌시아가,컷업 데님 팬츠 - 아이스:스테인드 / 805094TRW903969,1400990,48,0,0,67,0,,2024120120,pants
4442897,어반드레스,Unisex Bliss Suede Wide Pants - 5COL,46800,35,53,0,68,0,,2024120120,pants
4593615,아디다스,아디브레이크 팬츠 - 블랙 / IW3482,88990,25,29,0,69,0,블랙,2024120120,pants
4274021,리메인세컨드,내추럴 워싱 와이드 데님 팬츠 [흑청],22800,42,110,0,70,0,,2024120120,pants
4536559,언탭트 스튜디오,원턱 와이드 코듀로이 밴딩 팬츠 3Color,29580,30,342,32,71,0,,2024120120,pants
4623211,어프레쉬,[기모버전] 에어스트레치 조거팬츠_블랙 트레이닝,27900,54,53,0,72,0,블랙,2024120120,pants
4326417,무신사 스탠다드,시티 레저 폴라 플리스 벨티드 팬츠 [블랙],54290,15,89,0,73,0,블랙,2024120120,pants
4373554,메인부스,LAB.017 Balloon Denim Pants(INDIGO),89900,35,64,0,74,0,,2024120120,pants
4251988,무신사 스탠다드 우먼,우먼즈 벨루어 코듀로이 라운지 팬츠 [다크 그레이],35090,20,106,0,75,0,그레이,2024120120,pants
4322580,락케이크,96 Applique 2way Jogger - Black,65400,40,226,0,76,0,black,2024120120,pants
4579922,이에이,[이에이 X 짱구대디] ANGLE CARGO PANTS 2Color,69000,59,125,0,77,0,,2024120120,pants
4210111,무신사 스탠다드,데님 라이크 오피서 팬츠 [딥 인디고],48290,15,63,0,78,0,,2024120120,pants
4334135,마카사이트,더블니 카펜터 데님 팬츠 크림,32900,44,72,0,79,0,,2024120120,pants
4352414,무신사 스탠다드,14W 코듀로이 원 턱 와이드 밴딩 팬츠 [브라운],45790,15,90,0,80,0,브라운,2024120120,pants
4517755,음,사이드 버튼스냅 벌룬와이드 스웨트팬츠 기모추가 3COLOR,46500,33,56,0,81,0,,2024120120,pants
4496182,아디다스,테디 플리스 트랙 팬츠 - 블랙 / IX5502,53990,45,69,0,82,0,블랙,2024120120,pants
4381624,스켈리웩,스윙 벌룬핏 데님[인디고],47900,27,99,0,83,0,,2024120120,pants
4481761,론론,BACK HEART STITCH POCKET SWEAT JOGGER PANTS CREAM YELLOW,74250,25,78,0,84,0,,2024120120,pants
4460296,지크립,핀턱 벌룬핏 와이드 데님팬츠,24900,54,96,0,85,0,,2024120120,pants
4274093,리메인세컨드,원턱 와이드 코듀로이 밴딩 팬츠 [브라운],29800,24,121,0,86,0,브라운,2024120120,pants
4288947,디미트리블랙,ASI All-Sunday 와이드 데님 팬츠_더스트 인디고,33800,11,110,0,87,0,,2024120120,pants
4210194,무신사 스탠다드,코튼 파라슈트 팬츠 [다크 브라운],44890,10,106,0,88,0,브라운,2024120120,pants
4594684,아크시,기모 남여공용 블랙 워싱 벌룬핏 와이드 데님 유니섹스(블랙/블루/진청),31920,20,75,0,89,0,블랙 | 블루,2024120120,pants
4431789,오피쉬,"쿼드라플 레이스 트랙 팬츠, 네이비",87720,32,51,0,90,0,네이비,2024120120,pants
4300479,데케트,Curved Wide Jeans DCPT033CPBrown,27900,55,430,0,91,0,brown,2024120120,pants
4581831,셀렙샵에디션,[2pack] 24FW 마스터핏 기모 데님,67915,15,27,0,92,0,,2024120120,pants
4528522,유희,YOUHEE X LITTLE TWIN STAR LAYERED GRAPHIC PATTERN PANTS OATMEAL,119200,20,59,0,93,0,,2024120120,pants
4441071,고요웨어,코듀라 써멀 팬츠 (블랙),167320,11,17,0,94,0,블랙,2024120120,pants
4250212,어반디타입,홈보이 벌룬 워크 팬츠_카키,49240,29,59,0,95,0,,2024120120,pants
4564639,지크립,기모 핀턱 벌룬 핏 와이드 데님팬츠 [Black],25900,53,70,0,96,0,black,2024120120,pants
4296120,노운,corduroy denim pants (blue),117300,15,17,0,97,0,blue,2024120120,pants
4424071,테이크이지,벌룬 와이드핏 데님팬츠 (옐로우블루),62200,30,99,0,98,0,블루,2024120120,pants
4438457,앤더슨벨 포 우먼,데님 트롱프뢰유 레이어드 타잉 팬츠 apa768w(WASHED BLUE),360000,20,0,0,99,0,blue,2024120120,pants
4230725,무신사 스탠다드 우먼,[힛탠다드] 우먼즈 속기모 와이드 데님 팬츠 [워시드 블랙],40390,25,50,0,100,0,블랙,2024120120,pants
4365478,어프레쉬,에센셜 베이직 조거팬츠 2 COLOR,28100,40,25,0,101,0,,2024120120,pants
4496173,아디다스,파라슈트 팬츠 - 블랙 / IY2075,64990,50,65,0,102,0,블랙,2024120120,pants
4409072,브랜디드,EXTRA WIDE DENIM PANTS [MEDIUM BLUE],58800,40,160,0,103,0,blue,2024120120,pants
4498321,유니온스튜디오,스트링 카고 와이드 스웨트 팬츠 ( 3Color ),29800,11,69,0,104,0,,2024120120,pants
4329824,에이치덱스,자이언트핏 스웨트 팬츠 (Black),76000,20,25,0,105,0,black,2024120120,pants
4306136,브랜디드,COMFY JEANS (SMOKY LIGHT BLUE),78400,20,19,0,106,0,blue,2024120120,pants
4287850,슈퍼서브,도밍고 워싱 와이드 데님 팬츠 - 워시드 브라운,36900,47,148,0,107,0,브라운,2024120120,pants
4311942,세터,테오 코튼 밴딩 스웨트팬츠 멜란지 그레이,76450,45,34,0,108,0,그레이,2024120120,pants
4444997,트래드클럽 빈티지,투턱 기모 와이드 슬랙스,29000,67,64,0,109,0,,2024120120,pants
4486346,엑스컨테이너,딥 워싱 와이드 데님 팬츠  (WASHED DARK BLUE),32500,41,123,0,110,0,blue,2024120120,pants
4459430,몽돌,윈터ver) 원 턱 와이드 슬랙스 베이지 MDPT025FWBEIGE,59400,33,29,0,111,0,,2024120120,pants
4342832,고스트리퍼블릭,베이직 원턱 와이드 스웻팬츠 GLP-646,25500,32,81,0,112,0,,2024120120,pants
4422069,르아브,언타이틀 구르카팬츠 딥올리브,98100,10,47,0,113,0,,2024120120,pants
4306573,나이키,스포츠웨어 벨루어 와이드 레그 팬츠 W - 라이트 오어우드 브라운 / DQ5922-104,98100,10,13,0,114,0,브라운,2024120120,pants
4525026,디키즈,폴라텍 플리스 더블니 팬츠 Black,101200,15,40,0,115,0,black,2024120120,pants
4274077,리메인세컨드,원턱 와이드 코듀로이 밴딩 팬츠 [블랙],29800,24,91,0,116,0,블랙,2024120120,pants
4179591,카락터,Ptery double knee pants / Washed blue,148000,0,0,0,117,0,blue,2024120120,pants
4326420,무신사 스탠다드,시티 레저 폴라 플리스 벨티드 팬츠 [그레이쉬 베이지],54290,15,57,0,118,0,그레이,2024120120,pants
4537123,로우클래식,BRUSHED FLEECE LOOSE-FIT JEANS_WHITE_LC244PT12WH,141550,5,0,0,119,0,white,2024120120,pants
4266753,필루미네이트,핀 턱 테이핑 트레이닝 팬츠-와인,29300,49,82,0,120,0,,2024120120,pants
4429552,앵글런,Pit Pocket Dart Denim Balloon Pants - Denim,150410,11,10,0,121,0,,2024120120,pants
4595860,본투윈,FLEECE CHROME B SPORTS LINE SEMI WIDE PANTS [MELANGE GREY],98000,10,11,0,122,0,grey,2024120120,pants
4409069,브랜디드,EXTRA WIDE DENIM PANTS [SAND BLUE],58800,40,97,0,123,0,blue,2024120120,pants
4350275,챔브로스,우먼즈 세미 와이드 워싱  데님팬츠[딥블루],36400,30,71,0,124,0,블루,2024120120,pants
4297101,세컨모놀로그,[2PACK]세미 와이드핏 트윌 코튼 치노 팬츠 4 color_SEPT051,37800,68,78,0,125,0,,2024120120,pants
4428226,모이프,[AW24]TRAINER SWEAT PANTS / BLACK,141550,5,13,0,126,0,black,2024120120,pants
4537124,로우클래식,BRUSHED FLEECE LOOSE-FIT JEANS_BLUE_LC244PT12BL,141550,5,12,0,127,0,blue,2024120120,pants
4459607,칙스,루이스 스트레이트 데님 팬츠 Black denim,29900,40,147,0,128,0,black,2024120120,pants
4227337,무신사 스탠다드 우먼,우먼즈 딥 턱 베리어블 와이드 라운지 스웨트 팬츠 [블랙],32890,25,62,0,129,0,블랙,2024120120,pants
4422669,비바셔스,Gentle Bootscut Pants - 3COL,28340,45,156,0,130,0,,2024120120,pants
4342800,고스트리퍼블릭,카펜터 와이드 데님팬츠 GLP-514,38700,34,82,0,131,0,,2024120120,pants
4347632,쿠어,엠보 워시드 딥 커브드 데님 팬츠 (크림베이지),135000,10,13,0,132,0,,2024120120,pants
4602375,언더오프,융기모 히트 루즈핏 워싱 데님 인디고,29900,35,78,0,133,0,,2024120120,pants
4324279,언노운 플라넷,[기모버전 추가]데일리 투턱 와이드 스웨트 팬츠 그레이,46800,25,66,0,134,0,그레이,2024120120,pants
4336576,엑스컨테이너,더블니 카펜터 가먼트 다잉 팬츠 (GREIGE),35800,45,28,0,135,0,,2024120120,pants
4324236,언노운 플라넷,[기모버전 추가]데일리 투턱 와이드 스웨트 팬츠 블랙,46800,25,59,0,136,0,블랙,2024120120,pants
4605040,발데블랑코,와이드 원턱 코듀로이 기모 스트링 팬츠 [브라운],22900,54,41,0,137,0,브라운,2024120120,pants
4501467,아디다스,BB 트랙 팬츠 - 네이비:오렌지 / JD5264,64990,40,127,0,138,0,네이비,2024120120,pants
4450203,포터리,Shetland Wool Tapered Pants - 2 Color,259000,0,0,0,139,0,,2024120120,pants
4518143,아디다스,플리스 카고 팬츠 - 블랙 / IY9689,39990,49,53,0,140,0,블랙,2024120120,pants
4287648,무센트,(기모 선택) 코지 코듀로이 카고 와이드팬츠 남녀공용 (4컬러),49900,40,43,0,141,0,,2024120120,pants
4557878,엔피스튜디오,빈티지 네츄럴 워싱 와이드 데님 팬츠 진청,32800,58,57,0,142,0,,2024120120,pants
4291442,커스텀멜로우,Khaki Regular Fit Corduroy Setup Pants_C9PAW24851KHX,125100,10,0,0,143,0,,2024120120,pants
4343527,가까이 유니언즈,원턱 투 라인 와이드 스웨트팬츠 블랙,34900,30,88,0,144,0,블랙,2024120120,pants
4342151,엑스컨테이너,원턱 와이드 코듀로이 팬츠 (BLACK),33000,40,76,0,145,0,black,2024120120,pants
4271749,지크립,핀턱 벌룬핏 와이드 데님팬츠,24900,54,31,0,146,0,,2024120120,pants
4424153,스탠즈,[M~4XL] 워싱 데님 밴딩 팬츠_블루,59900,40,16,0,147,0,블루,2024120120,pants
4308185,디미트리블랙,VLAD 원턱 피그먼트 페이드 워싱 스웻 팬츠_핑크,33800,28,79,0,148,0,,2024120120,pants
4434219,스파오,[WARM] 와이드 진_SPTJE4VG51,39920,20,21,0,149,0,,2024120120,pants
4534303,디미토,VTX BASIS 2L PANTS MIST GREY,249000,0,0,0,150,0,grey,2024120120,pants
4368610,무신사 스탠다드,피그먼트 엑스트라 와이드 카고 데님 팬츠 [스모크 핑크],59090,20,10,0,151,0,,2024120120,pants
4555810,안다르,에어리핏 기모 와이드 팬츠,39600,43,32,0,152,0,,2024120120,pants
4341064,토런스,파이핑 트랙 와이드 팬츠,59000,40,14,0,153,0,,2024120120,pants
4400330,본투윈,REFLECTIVE LINE BIG SYMBOL WIDE PANTS [CHARCOAL],79000,11,16,0,154,0,charcoal,2024120120,pants
4514495,트릴리온,더블 레이어 카펜터 카고 데님 팬츠 [옐로우 블랙],44300,21,16,0,155,0,블랙,2024120120,pants
4444784,아워 레가시,트래블 컷 데님 팬츠 - 블랙 / W4245TR,310990,49,0,0,156,0,블랙,2024120120,pants
4306182,브랜디드,COMFY JEANS (WASHED BLACK),78400,20,34,0,157,0,black,2024120120,pants
4483606,더콜디스트모먼트,TCM flower washed sweat pants (black),78400,20,17,0,158,0,black,2024120120,pants
4382754,밈더워드로브,솔라 리벳 카펜터 팬츠_블랙,75600,30,10,0,159,0,블랙,2024120120,pants
4352405,무신사 스탠다드,플레어 히든 밴딩 슬랙스 [블랙],37290,15,42,0,160,0,블랙,2024120120,pants
4200797,스파오,빈티지 와이드 진_SPTJE49C56,44900,10,11,0,161,0,,2024120120,pants
4276263,무신사 스탠다드,코티드 스트레이트 데님 팬츠 [블랙],44890,25,16,0,162,0,블랙,2024120120,pants
4329829,에이치덱스,자이언트핏 스웨트 팬츠 (Melange Gray),76000,20,15,0,163,0,,2024120120,pants
4283718,언탭트 스튜디오,딥 원턱 와이드 롱 스웨트 트레이닝 팬츠 2 COLOR,24860,30,155,0,164,0,,2024120120,pants
4313150,마인드브릿지,퍼티그블랙로우데님팬츠 MYDP6151,53800,40,28,0,165,0,블랙,2024120120,pants
4284200,엑스톤즈,XP246 라이즈 벌룬 코튼 팬츠 (KHAKI),43500,50,51,0,166,0,,2024120120,pants
4543721,오로,코듀로이 숏 팬츠_Espresso,42000,31,27,0,167,0,,2024120120,pants
4446414,호이테,RISE CORDUROY WORK PANTS (BLACK),227700,15,0,0,168,0,black,2024120120,pants
4316187,비긴202,Nycoma Two Tuck Pants V3 [Black],111200,20,26,0,169,0,black,2024120120,pants
4336886,썸웨어버터,Peach Cotton Short Pants - Black,107100,10,11,0,170,0,black,2024120120,pants
4229170,무신사 스탠다드 우먼,[힛탠다드] 우먼즈 헤비웨이트 속기모 딥 턱 와이드 슬랙스 [차콜 그레이],42390,15,88,0,171,0,그레이 | 차콜,2024120120,pants
4626034,썸플레이스,벌룬 와이드 코듀로이 스티치 포인트 코튼 팬츠 [브라운],29400,40,27,0,172,0,브라운,2024120120,pants
4358808,브랜디드,1791 MUD BROWN JEANS [WIDE STRAIGHT],68600,30,56,0,173,0,brown,2024120120,pants
4383328,페이더먼트,[S~4XL] 피그먼트 절개 조거 팬츠,24000,60,145,0,174,0,,2024120120,pants
4602374,언더오프,융기모 히트 루즈핏 워싱 데님 블랙,29900,35,19,0,175,0,블랙,2024120120,pants
4322696,시즈,[데일리룸 X 시즈] 벌룬 레그 밀 와이드 카고 팬츠 [CHARCOAL],70300,20,21,0,176,0,charcoal,2024120120,pants
4308180,디미트리블랙,바이오워싱 와이드 카펜터 데님 팬츠_더스트 인디고,27900,37,280,0,177,0,,2024120120,pants
4241658,언탭트 스튜디오,YKK 바이오워싱 와이드 카고 데님팬츠,36900,40,112,0,178,0,,2024120120,pants
4250214,어반디타입,홈보이 벌룬 워크 팬츠_블랙,49240,29,86,0,179,0,블랙,2024120120,pants
4556620,스켈리웩,이지 코듀로이 와이드 팬츠[블랙],39900,32,39,0,180,0,블랙,2024120120,pants
4210149,무신사 스탠다드,속기모 나일론 와이드 스트링 팬츠 [더스티 베이지],39890,20,61,0,181,0,,2024120120,pants
4596387,썸플레이스,배색 파이핑 라인 트레이닝 와이드 스트링 조거 팬츠 [블랙],29400,40,20,0,182,0,블랙,2024120120,pants
4252006,무신사 스탠다드 우먼,우먼즈 샤기 플리스 와이드 라운지 팬츠 [라이트 블루],31890,20,211,0,183,0,블루,2024120120,pants
4461189,아캄,Needlework Carpenter Denim Pants (Blue),169100,10,14,0,184,0,blue,2024120120,pants
4368566,무신사 스탠다드,브러쉬드 투 턱 와이드 히든 밴딩 슬랙스 [블랙],43090,20,35,0,185,0,블랙,2024120120,pants
4363599,데이,커브드 플레어 데님 (W)_VINTAGE DENIM,49100,26,56,0,186,0,,2024120120,pants
4230726,무신사 스탠다드 우먼,[힛탠다드] 우먼즈 속기모 와이드 데님 팬츠 [딥 인디고],45790,15,93,0,187,0,,2024120120,pants
4198785,나이키,스포츠웨어 스우시 오픈 헴 플리스 팬츠 M - 다크 그레이 헤더:화이트 / FN3343-063,121500,10,29,0,188,0,그레이 | 화이트,2024120120,pants
4320791,아디다스,70s 트랙 팬츠 - 블루 / IX5222,65990,26,10,0,189,0,블루,2024120120,pants
4336573,엑스컨테이너,더블니 카펜터 가먼트 다잉 팬츠 (WASHED BLACK),39000,40,38,0,190,0,black,2024120120,pants
4184712,언지미크,Wave Tuck Washed Denim Pants - Beige,198400,20,0,0,191,0,,2024120120,pants
4498316,유니온스튜디오,스트링 와이드 스웨트 팬츠 ( 3Color ),25800,10,131,0,192,0,,2024120120,pants
4441674,다이브인,WIDE CURVERD DENIM PANTS (WASHED DARK BLUE),97010,11,10,0,193,0,blue,2024120120,pants
4344100,썸플레이스,핀턱 절개 스티치 히든 스트링 백로고 코튼 와이드 팬츠 [블랙],39000,40,24,0,194,0,블랙,2024120120,pants
4264600,아워 레가시,써드 컷 데님 팬츠 - 슈퍼그레이 워시 / M4195TS,244990,50,16,0,195,0,그레이,2024120120,pants
4556653,스켈리웩,코튼 스윙 벌룬핏 팬츠[블랙],35900,48,74,0,196,0,블랙,2024120120,pants
4251558,챔브로스,논페이드 와이드 데님팬츠[라이트 블루],35800,48,19,0,197,0,블루,2024120120,pants
4323233,알리스,[오정규X알리스] 패널드 카펜터 와이드 팬츠 [라이트베이지],68600,30,56,0,198,0,,2024120120,pants
4308264,9999아카이브,Vintage Sweat Pants,62300,30,16,0,199,0,,2024120120,pants
4300634,데케트,Double Knee Fatigue Wide Jeans DCPT052STNGRBlue,44400,40,26,0,200,0,blue,2024120120,pants
4286369,미치코런던,투핀턱 와이드 슬랙스 블랙,44250,25,18,0,201,0,블랙,2024120120,pants
4387107,토마스모어,빌리 스웻 팬츠-차콜네이비,59700,0,10,0,202,0,차콜 | 네이비,2024120120,pants
4352389,무신사 스탠다드,피그먼트 와이드 스웨트 팬츠 [차콜 그레이],44090,15,12,0,203,0,그레이 | 차콜,2024120120,pants
4423717,에이치덱스,챔프스 스트레이트 스웨트 팬츠 (Black),68000,20,19,0,204,0,black,2024120120,pants
4459431,몽돌,윈터ver) 원 턱 와이드 슬랙스 차콜 MDPT025FWCHARCOAL,59400,33,38,0,205,0,charcoal | 차콜,2024120120,pants
4210133,무신사 스탠다드,시티 레저 CN 벨티드 유틸리티 팬츠 [그레이],59390,15,127,0,206,0,그레이,2024120120,pants
4210131,무신사 스탠다드,시티 레저 CN 벨티드 유틸리티 팬츠 [블랙],59390,15,45,0,207,0,블랙,2024120120,pants
4458382,밀로 아카이브,더블 라운드 팬츠 [카키 브라운],89600,30,53,0,208,0,브라운,2024120120,pants
4342050,엑스컨테이너,빈티지 워시드 와이드 데님 팬츠 (SAND BROWN),33000,40,43,0,209,0,brown,2024120120,pants
4488985,그린버터,Corduroy Wide Pants (Brick Red),88200,10,0,0,210,0,,2024120120,pants
4299915,나우,M GW 변형카고팬츠_LK,179000,0,0,0,211,0,,2024120120,pants
4332686,스켈리웩,카모플라쥬 트레이닝 팬츠[그레이],39910,42,117,0,212,0,그레이,2024120120,pants
4428200,모이프,[AW24]SIMO PANTS / BLACK,227050,5,13,0,213,0,black,2024120120,pants
4517290,에스피오나지,Expl. Fleece Pants Olive,86400,20,67,0,214,0,,2024120120,pants
4390387,999휴머니티,커브드 헤리티지 데님 (스노우 블랙),173000,0,0,0,215,0,블랙,2024120120,pants
4586031,가까이 유니언즈,더블 포스타 벌룬 팬츠 블랙,39900,36,52,0,216,0,블랙,2024120120,pants
4324770,나이스고스트클럽,LOGO SWEAT LAYERED PANTS_CHARCOAL(NG2DFUPA91A),41300,30,14,0,217,0,charcoal,2024120120,pants
4497809,모이프,[AW24]HIKER PANTS / BLACK,221000,0,10,0,218,0,black,2024120120,pants
4363681,르메르,유도 데님 팬츠 - 블랙 / PA1152LD1004BK999,458990,50,0,0,219,0,블랙,2024120120,pants
4480886,에이치덱스,메인로고 기모 조거 스웨트 팬츠 (Black),55200,35,19,0,220,0,black,2024120120,pants
