productId,brandName,productName,price,discountRate,currentlyViewing,currentlyBuying,ranking,trending,colors,date
4327173,노스페이스,NC1DQ50J 화이트라벨 액션 프리 RDS 다운 코트_BLACK,358000,0,761,51,1,0,black | 화이트,20241127
4241903,노스페이스,NJ1DQ80J 화이트라벨 여성 노벨티 눕시 RDS 다운 자켓_BLACK,368000,0,1100,0,2,0,black | 화이트,20241127
4633419,노스페이스,NJ1DQ51J 화이트라벨 노벨티 눕시 RDS 다운 자켓_BLACK,398000,0,537,0,3,0,black | 화이트,20241127
4349548,제이엘브,심볼 로고 풋볼 저지,22000,78,1500,413,4,0,,20241127
4286631,노스페이스,NJ3NQ53A 남성 눕시 온볼 자켓_BLACK,224100,10,3100,40,5,0,black,20241127
4286964,노스페이스,NJ4FQ50J 화이트라벨 컴피 알파 플리스 집업_BLACK,108000,0,802,48,6,0,black | 화이트,20241127
4345672,노스페이스,NJ1DQ52J 화이트라벨 프리 무브 RDS 다운 자켓_BLACK,338000,0,258,0,7,0,black | 화이트,20241127
4447175,노스페이스,NJ1DQ85Q 화이트라벨 여성 노벨티 눕시 RDS 다운 자켓_CREAM,368000,0,686,0,8,0,화이트,20241127
4518081,노스페이스,NJ1DQ52A 남성 펠릭스 RDS 다운 자켓_BLACK,395090,10,316,0,9,0,black,20241127
4383452,노스페이스,NC1DQ51A 남성 액트 프리 EX 하이브리드 다운 코트,319000,0,178,0,10,0,,20241127
4616765,노스페이스,NJ1DQ83L 화이트라벨 여성 글로우 디테쳐블 RDS 다운 자켓_SILVER GRAY,368000,0,100,0,11,0,화이트,20241127
4604316,노스페이스,NC1DQ50A 남성 챌린지 에어 RDS 다운 코트_BLACK,459000,0,47,0,12,0,black,20241127
4518130,노스페이스,NJ3NQ80A 여성 뉴 퍼피 EX 온볼 자켓_BLACK,224090,10,1200,0,13,0,black,20241127
4502200,노스페이스,NJ1DQ53A 남성 1994 레트로 힘 다운 파카 (RDS 다운)_BLACK,621000,10,81,0,14,0,black,20241127
4508146,내셔널지오그래픽,N244UDW910 레이만 숏기장 다운 점퍼 CARBON BLACK,269000,10,82,0,15,0,black,20241127
4507921,뉴발란스,NBNPE4W102 / WOMEN 액티브 숏 구스다운 (6컬러),299000,0,986,0,16,0,,20241127
4548778,노스페이스,NJ1DQ06A 남성 히말라얀 라이트 파카 (RDS),590000,0,107,0,17,0,,20241127
4410061,노스페이스,NJ1DQ79F 슈퍼플렉스 눕시 다운 자켓 (RDS)_REAL BLACK,386100,10,189,0,18,0,black,20241127
4345731,노스페이스,NJ3NQ83D 여성 눕시 온볼 자켓_PALE PINK,224090,10,953,0,19,0,,20241127
4456849,노스페이스,NJ1DQ64A 남성 오푸스 RDS 다운 자켓_BLACK,431090,10,106,0,20,0,black,20241127
4470917,무신사 스탠다드 스포츠,코어 익스트림 패딩 자켓 (3color),83940,40,636,47,21,0,,20241127
4525862,뉴에라,AP MLB STADIUM JK43 NEYYAN D BLU,139300,30,294,0,22,0,,20241127
4548676,노스페이스,NJ1DQ66A 남성 1996 워터 쉴드 눕시 다운 자켓_BEIGE BROWN,413100,10,85,0,23,0,brown,20241127
4286590,노스페이스,NJ1DQ75F 남성 1996 에코 눕시 자켓_BROWN,399000,0,163,0,24,0,brown,20241127
4548576,노스페이스,NJ1DQ98A 히말라얀 30주년 기념 파카 (RDS 다운),950000,0,61,0,25,0,,20241127
4565779,노스페이스,NJ3NQ71A 남성 아스펜 EX 온볼 자켓_BLACK,197100,10,607,0,26,0,black,20241127
4595695,노스페이스,NJ1DQ86A 여성 눕시 숏 자켓_BLACK,369000,0,183,0,27,0,black,20241127
4604451,노스페이스,NJ1DQ91A 여성 로프티 RDS 다운 자켓_BLACK,305090,10,176,0,28,0,black,20241127
4327132,노스페이스,NJ3NQ53B 남성 눕시 온볼 자켓_GRAY,224090,10,386,0,29,0,,20241127
4305217,무신사 스탠다드 스포츠,탱커 무브 패딩 자켓 (4color),83940,40,810,38,30,0,,20241127
4504359,디스커버리 익스페디션,여성 루이크 구스다운 롱패딩 (BLACK),590000,0,19,0,31,0,black,20241127
4329700,에이치덱스,자이언트핏 럭비 저지 롱 슬리브,53400,40,474,52,32,0,,20241127
4617954,노스페이스,NC1DQ70A 남성 아스펜 테크 RDS 다운 코트_BLACK,539000,0,17,0,33,0,black,20241127
4502117,제이엘브,퍼 후드집업,86000,54,39,0,34,0,,20241127
4595866,본투윈,FLEECE BRNTW TRACK LINE SWEATSHIRTS [BLACK],84000,11,127,0,35,0,black,20241127
4549090,노스페이스,NJ1DQ85J 화이트라벨 여성 노벨티 눕시 RDS 다운 자켓,368000,0,102,0,36,0,화이트,20241127
4604545,노스페이스,NE3CQ61A 익스페디션 이어머프 캡_BLACK,79000,0,252,0,37,0,black,20241127
4525596,본투윈,CHROME B FLEECE JACKET [BLACK],143000,10,14,0,38,0,black,20241127
4548969,노스페이스,NJ1DQ86J 화이트라벨 여성 노벨티 눕시 디테쳐블 다운 자켓 (RDS)_BLACK,408000,0,228,0,39,0,black | 화이트,20241127
4548961,노스페이스,NJ1DQ86K 화이트라벨 여성 노벨티 눕시 디테쳐블 다운 자켓 (RDS)_BROWN,408000,0,278,0,40,0,brown | 화이트,20241127
4525527,본투윈,CHROME B BLACK LINE WIDE PANTS [BLACK],98000,10,67,0,41,0,black,20241127
4548667,노스페이스,NJ1DQ66B 남성 1996 워터 쉴드 눕시 다운 자켓_BLACK,413100,10,64,0,42,0,black,20241127
4347528,케이투,씬에어(THINAIR) ANANTA PARKA_Black,399000,13,14,0,43,0,black,20241127
4525319,본투윈,BIG CHROME REFLECTIVE LINE HOODIE [BLACK],107000,10,148,0,44,0,black,20241127
4565900,노스페이스,NC1DQ85A 여성 눕시 벨티드 다운 코트 (RDS 다운)_BLACK,386090,10,118,0,45,0,black,20241127
4305227,나인제트,헤비코튼 크루넥 머슬 니트 (블랙) 24NTL01,49990,40,517,0,46,0,블랙,20241127
4518187,노스페이스,NJ1DQ82J 화이트라벨 여성 웨이브 RDS 다운 자켓_BLACK,358000,0,68,0,47,0,black | 화이트,20241127
4507204,스노우피크 어패럴,실키 여성 스탠드넥 미들 다운 자켓 (S24WWTDJ29) Brown,265050,5,22,0,48,0,brown,20241127
4464735,나이키,ACG 써마 핏 ADV 루나 레이크 자켓 M - 라이트 오어우드 브라운:서밋 화이트 / FV8911-104,324000,20,142,0,49,0,브라운 | 화이트,20241127
4595876,본투윈,STROKE B SHERPA JACKET [BLACK],143000,10,73,0,50,0,black,20241127
4589008,코오롱스포츠,남성 다운 테라노바 JWJDW24271GRI,490000,14,0,0,51,0,,20241127
4525525,본투윈,CHROME B BLACK LINE WIDE PANTS [MELANGE GREY],98000,10,11,0,52,0,black | grey,20241127
4298658,나인제트,시그니처 모크넥 머슬핏 긴팔 티셔츠 (블랙) NSTL03,33750,25,150,0,53,0,블랙,20241127
4456844,노스페이스,NJ1DQ79E 슈퍼플렉스 눕시 다운 자켓 (RDS)_CREAM,386100,10,264,0,54,0,,20241127
4595910,본투윈,BIG SYMBOL PUFFER DOWN [BLACK],323000,10,90,0,55,0,black,20241127
4549950,노스페이스,NE3CQ52J 화이트라벨 왁스 코튼 이어머프 캡,62090,10,289,0,56,0,화이트,20241127
4502357,노스페이스,NJ1DQ83A 여성 1994 레트로 힘 다운 자켓 (RDS 다운)_BLACK,531000,10,57,0,57,0,black,20241127
4519729,밀레,호멘느 구스 벤치 파카_MQSWD471,139000,60,98,0,58,0,,20241127
4527940,노스페이스,NE3BQ53A 플리스 이어머프 비니_BLACK,43000,0,161,0,59,0,black,20241127
4578699,카파,웰론 롱다운 파카 블랙,73000,45,61,0,60,0,블랙,20241127
4548659,노스페이스,NJ1DQ66C 남성 1996 워터 쉴드 눕시 다운 자켓_REAL BLACK,413100,10,31,0,61,0,black,20241127
4288590,노스페이스,NJ1DQ59K 화이트라벨 유트로 EX RDS 다운 자켓_DARK GRAY,222400,20,13,0,62,0,화이트,20241127
4287112,노스페이스,NJ1DQ85D 여성 1996 에코 눕시 자켓_CREAM,399000,0,255,0,63,0,,20241127
4368438,케이투,GOLDEN K95 베이글(BAGEL) W_TITANIUM BLACK,399200,20,25,0,64,0,black,20241127
4555333,시에라디자인,뮤어(MUIR) 경량 구스다운 후드자켓 GREY,379000,0,28,0,65,0,grey,20241127
4238397,나이키,프리 메트콘 6 W - 화이트:데님 터콰이즈:블랙:핫 펀치: / FJ7126-102,83400,40,45,0,66,0,블랙 | 화이트,20241127
4578407,노스페이스,NJ1DQ88K 화이트라벨 여성 글로시 디테쳐블 RDS 다운 자켓_COCOA BROWN,368000,0,63,0,67,0,brown | 화이트,20241127
4508235,내셔널지오그래픽,N244UDW851 카이만 숏기장 구스 후디 다운 점퍼 CARBON BLACK,369000,8,24,0,68,0,black,20241127
4518184,노스페이스,NJ1DQ82K 화이트라벨 여성 웨이브 RDS 다운 자켓_BROWN,358000,0,51,0,69,0,brown | 화이트,20241127
4628709,푸마,U 울트라 1 리버서블 롱다운 아시안핏(94128801),179000,40,37,0,70,0,,20241127
4619234,내셔널지오그래픽,N224MDW950 남성 리머 리버시블 플리스 후디 덕다운 점퍼,139500,53,296,0,71,0,,20241127
4233897,노스페이스,NM2DQ52L 화이트라벨 미니샷_WHITE SAND,98100,10,29,0,72,0,white | 화이트,20241127
4495565,데상트,2023 캐논 구스 롱다운 자켓 블랙(SO323XDJ91),328300,30,33,0,73,0,블랙,20241127
4527702,스노우피크 어패럴,여성 카라 부클넥 헤비 다운 자켓 (S24WWGDJ57) Light Beige,312550,5,98,0,74,0,,20241127
4220952,나이키,페가수스 41 W - 팬텀:라이트 퍼미스:세일:메탈릭 골드  / FD2723-005,103350,35,62,0,75,0,,20241127
4549686,노스페이스,NJ3NQ50J 화이트라벨 리버톤 온볼 후디_BLACK,206390,20,98,0,76,0,black | 화이트,20241127
4589878,노스페이스,NJ1DQ91B 여성 로프티 RDS 다운 자켓_SAND SHELL,305090,10,12,0,77,0,,20241127
4595868,본투윈,FLEECE BRNTW FOOTBALL CLUB OVER FIT HOODIE [BLACK],88000,10,76,0,78,0,black,20241127
4490492,컬럼비아,헨리포크 부츠 OT OHI - 블랙,152150,15,34,0,79,0,블랙,20241127
4297879,내셔널지오그래픽,N244UDW920 헤론 U넥 경량 다운 점퍼 CARBON BLACK,149000,12,55,0,80,0,black,20241127
4480912,에이치덱스,코어 아플리케 후디 집업 (Black),84000,20,14,0,81,0,black,20241127
4589023,코오롱스포츠,여성 폭스퍼 롱다운 스노우문 TVJDW24562BUT,570000,12,0,0,82,0,,20241127
4518110,노스페이스,NJ3BQ53L 화이트라벨 밴든 자켓_BEIGE BROWN,142390,20,28,0,83,0,brown | 화이트,20241127
3479992,디스커버리 익스페디션,반슬리 고프코어 다운 (BLACK),279000,0,24,0,84,0,black,20241127
4447479,디스커버리 익스페디션,여성 헤이니 글로우 다운 (BLACK),279000,0,68,0,85,0,black,20241127
4525859,뉴에라,MLB LA다저스 스타디움 재킷 블랙,139300,30,157,0,86,0,블랙,20241127
4273714,아디다스,아스널 24/25 어웨이 저지 IT6148,77350,35,34,0,87,0,,20241127
4503438,노스페이스,NE3CQ54K 화이트라벨 플리스 이어머프 캡_WHITE SAND,53090,10,35,0,88,0,white | 화이트,20241127
4516446,코오롱스포츠,남녀공용 캠프 부츠 FE3AX24870BLK,180000,14,10,0,89,0,,20241127
4329829,에이치덱스,자이언트핏 스웨트 팬츠 (Melange Gray),66500,30,55,0,90,0,,20241127
4559495,아이더,라헨느 여성 캐시미어 W/S 롱 다운 자켓_Dark Beige,529000,15,20,0,91,0,,20241127
4522547,컬럼비아,공용 마운틴 후드 롱 다운 자켓 C54YM3479010,329400,40,55,0,92,0,,20241127
4368439,케이투,GOLDEN K95 베이글(BAGEL) W_BEIGE PINK,439000,12,119,0,93,0,,20241127
4400979,호카,(공용) 카하 2 프로스트 모크 GTX - 블랙:아우터 오르빗 / 1157392-BCKT,259000,0,20,0,94,0,블랙,20241127
4541582,코오롱스포츠,여성 다운 쿠치 JKJDW24252BEI,430000,12,39,0,95,0,,20241127
4541584,코오롱스포츠,여성 다운 쿠치 JKJDW24252BLK,430000,12,21,0,96,0,,20241127
4323696,네파,7K72075 남성 아르테 다운 자켓,629000,17,0,0,97,0,,20241127
4580659,시에라디자인,겟다운(GET DOWN) 구스다운 자켓 GREY,499000,0,23,0,98,0,grey,20241127
4548743,노스페이스,NJ1DQ17A 남성 고어텍스 마운틴 다운 자켓 (RDS)_BLACK,620990,10,19,0,99,0,black,20241127
4602451,아크테릭스,베타 자켓 남성 - BLACK / AJOFMX8584,617500,5,103,0,100,0,black,20241127
4548940,노스페이스,NJ1DQ86L 화이트라벨 여성 노벨티 눕시 디테쳐블 다운 자켓 (RDS)_CREAM,408000,0,170,0,101,0,화이트,20241127
4290137,미즈노,MXR,96200,19,24,0,102,0,,20241127
4503422,노스페이스,NE3CQ56J 화이트라벨 퍼피 플리스 이어머프 EX 캡,69000,0,166,0,103,0,화이트,20241127
4627155,머슬암드,ARMED 23 롱슬리브 저지 2 Color,39900,66,84,0,104,0,,20241127
4551518,노르디스크,유니 크리스탈다운 덱 점퍼_Black,399000,0,28,0,105,0,black,20241127
4503515,노스페이스,NS93Q57A 구스 다운 슬립 온,95190,20,57,0,106,0,,20241127
4559230,노스페이스,NE3CQ62B 플리스 이어머프 EX 캡_COCOA BROWN,59000,0,85,0,107,0,brown,20241127
4401940,내셔널지오그래픽,N243USW901 스탠다드 벨룩스 세미오버핏 맨투맨 CARBON BLACK,79000,0,35,0,108,0,black,20241127
4578455,노스페이스,NE3BQ53B 플리스 이어머프 비니_SAND SHELL,43000,0,111,0,109,0,,20241127
4400330,본투윈,REFLECTIVE LINE BIG SYMBOL WIDE PANTS [CHARCOAL],79000,11,53,0,110,0,charcoal,20241127
4330417,아식스,젤-택틱 12(1071A090100) 인도어화,116100,10,18,0,111,0,,20241127
4420185,노스페이스,NJ1DQ79C 슈퍼플렉스 눕시 다운 자켓 (RDS)_NAVY,386100,10,295,0,112,0,navy,20241127
4543824,노르디스크,남성 유틸리티 크리스탈다운 점퍼 - 카르베_Black,459000,0,0,0,113,0,black,20241127
4440602,내셔널지오그래픽,N244UDW922 후드 헤론 구스 다운 점퍼 LICHEN KHAKI,229000,12,73,0,114,0,,20241127
4503333,노스페이스,NM5MQ53J 화이트라벨 밴든 우븐 크루넥,75590,30,16,0,115,0,화이트,20241127
4297861,내셔널지오그래픽,N244WDW920 여성 헤론 U넥 경량 다운 점퍼 CRYSTAL BEIGE,149000,12,102,0,116,0,,20241127
4548709,노스페이스,NJ1DQ65A 남성 고어 눕시 다운 자켓 (RDS 다운)_BLACK,449100,10,11,0,117,0,black,20241127
4369562,노스페이스,NJ3BQ53J 화이트라벨 밴든 자켓_BLACK,142390,20,112,0,118,0,black | 화이트,20241127
4370422,아이더,CIRCULART (써큘라트) β 테크니컬 푸퍼 다운 자켓_OATMEAL GREY,429000,12,0,0,119,0,grey,20241127
4604427,노스페이스,NP6NQ55A 남성 지오돔 V 팬츠_BLACK,143190,20,10,0,120,0,black,20241127
4525317,본투윈,BIG CHROME REFLECTIVE LINE HOODIE [MELANGE GREY],107000,10,32,0,121,0,grey,20241127
4559498,아이더,라헨느 여성 캐시미어 W/S 롱 다운 자켓_OATMEAL GREY,529000,15,34,0,122,0,grey,20241127
4407394,아식스,코트 FF 3 노박(1041A361964) 테니스화,209000,0,10,0,123,0,,20241127
4531902,아크테릭스,토륨 SV 파카 남성 - BLACK / AJOFMX8947,1035500,5,11,0,124,0,black,20241127
4345669,노스페이스,NJ1DQ52K 화이트라벨 프리 무브 RDS 다운 자켓_BROWN,338000,0,55,0,125,0,brown | 화이트,20241127
4595874,본투윈,FLEECE CAMO HOODIE ZIP-UP [MELANGE GREY],125000,10,100,0,126,0,grey,20241127
3543329,디스커버리 익스페디션,여성 디하스 U넥 튜브 구스다운 경량패딩 (BLACK),199000,0,0,0,127,0,black,20241127
4493169,데상트,베일러 푸퍼 다운 자켓 블랙(SP423IDJO2),399000,0,21,0,128,0,블랙,20241127
4368416,케이투,씬에어(THINAIR) ANANTA PARKA W_Greyish Khaki,399000,13,0,0,129,0,grey,20241127
4613743,컬럼비아,공용 샙랜드3 WP OHI,199000,0,25,0,130,0,,20241127
4505876,블랙야크,여성 히마 WSP 다운자켓_DU,499000,29,42,0,131,0,,20241127
4610883,노스페이스,NJ1DQ50J 화이트라벨 노벨티 눕시 에어 RDS 다운 자켓_BLACK,398000,0,159,0,132,0,black | 화이트,20241127
4589792,노스페이스,NJ3NQ56A 남성 지오돔 V 가디건_BLACK,132290,30,29,0,133,0,black,20241127
4548853,노스페이스,NC1DQ99A 남성 히말라얀 코트 (RDS),990000,0,37,0,134,0,,20241127
4509946,내셔널지오그래픽,N244UDW820 골든몰 숏기장 구스 후디 다운 점퍼 CARBON BLACK,329000,8,56,0,135,0,black,20241127
4463729,디스커버리 익스페디션,여성 켈리 구스다운 미드패딩 (BLACK),490000,0,20,0,136,0,black,20241127
4525524,본투윈,CHROME B BLACK LINE WIDE PANTS [WHITE],98000,10,11,0,137,0,black | white,20241127
4264710,나이키,페가수스 41 M - 화이트:볼트:블랙 / FD2722-104,127200,20,23,0,138,0,블랙 | 화이트,20241127
4534657,디미토,GTX AIRFLY DOWN JACKET BLACK,379000,0,14,0,139,0,black,20241127
4616801,노스페이스,NJ1DQ83K 화이트라벨 여성 글로우 디테쳐블 RDS 다운 자켓_BROWN,368000,0,50,0,140,0,brown | 화이트,20241127
4592068,네파,7H82044 여성 라츠가 보머 다운 자켓 (2color),89950,76,245,0,141,0,,20241127
4327121,노스페이스,NJ3NQ53C 남성 눕시 온볼 자켓_CREAM BEIGE,224090,10,277,0,142,0,,20241127
4548688,노스페이스,NJ1DQ65C 남성 고어 눕시 다운 자켓 (RDS 다운)_STEEL GRAY,449100,10,18,0,143,0,,20241127
4549770,노스페이스,NJ1DQ58J 화이트라벨 네오 퍼피 RDS 다운 자켓_BLACK,298000,0,150,0,144,0,black | 화이트,20241127
4401920,내셔널지오그래픽,N244UPV902 아웃포켓 패딩 베스트 LICHEN KHAKI,90300,30,34,0,145,0,,20241127
4495072,피지컬가먼츠,P2460 하프넥 항공 점퍼 패딩 [2 COLOR],118900,35,11,0,146,0,,20241127
4249827,나이키,ACG 드라이 핏 갤럭시 티셔츠 M - 써밋 화이트 / FZ5276-121,32500,50,36,0,147,0,화이트,20241127
4501939,본투윈,BRN EMBLEM BOOSTER JOGGER PANTS [BLACK],71000,10,44,0,148,0,black,20241127
4531906,아크테릭스,토륨 SV 후디 남성 - BLACK SAPPHIRE / AJOFMX8946,883500,5,40,0,149,0,black,20241127
4531898,아크테릭스,세륨 SV 후디 남성 - BLACK / AJOFMX8429,883500,5,51,0,150,0,black,20241127
4531899,아크테릭스,세륨 SV 후디 남성 - BLACK SAPPHIRE / AJOFMX8429,883500,5,20,0,151,0,black,20241127
4583511,어반사이드 어패럴,[915FP 구스다운] 에일러론 900 울트라라이트 다운 재킷,351200,20,23,0,152,0,,20241127
4354318,케이투,GOLDEN K95 베이글(BAGEL)_Black,439000,12,18,0,153,0,black,20241127
4540577,노스페이스,NC1DQ51J 화이트라벨 액션 테크 RDS 다운 코트_BLACK,438000,0,29,0,154,0,black | 화이트,20241127
4508206,내셔널지오그래픽,N244WDW851 여성 카이만 숏기장 구스 후디 다운 점퍼 BEIGE,349000,8,12,0,155,0,,20241127
4420214,노스페이스,NJ2HQ50J 화이트라벨 네오 베이든 자켓_BLACK,174390,20,123,0,156,0,black | 화이트,20241127
4287250,노스페이스,NA5IQ53J 화이트라벨 이어머프_BLACK,31490,10,48,0,157,0,black | 화이트,20241127
4495881,미즈노,WAVE MUJIN TL GTX_D1GA237301,167200,20,17,0,158,0,,20241127
4475343,디스커버리 익스페디션,남성 루이스 구스다운 경량패딩 (BLACK),167300,30,14,0,159,0,black,20241127
4437113,디스커버리 익스페디션,여성 올리브 글로우 다운 (L/GREY),279000,0,55,0,160,0,grey,20241127
4368455,케이투,GOLDEN K95 베이글(BAGEL) FLEX HOODY W_Black,419000,13,15,0,161,0,black,20241127
4286917,노스페이스,NJ3BQ55A 남성 데날리 윈드 EX 자켓_BLACK,111300,30,50,0,162,0,black,20241127
4518170,노스페이스,NJ1DQ84A 여성 오푸스 RDS 다운 자켓_BLACK,413090,10,94,0,163,0,black,20241127
4525553,본투윈,BIG CHROME B BLACK LINE ZIP-UP HOODIE [MELANGE GREY],116000,10,36,0,164,0,black | grey,20241127
4246273,미즈노,모렐리아 살라 클럽 TF,54450,45,43,0,165,0,,20241127
4486583,리,트루퍼햇 베이지,53100,10,48,0,166,0,,20241127
4429726,네파,7KF2022 공용 사이폰 다운 자켓 (3color),269000,16,23,0,167,0,,20241127
4287121,노스페이스,NJ1DQ85C 여성 1996 에코 눕시 자켓_BROWN,399000,0,107,0,168,0,brown,20241127
4507202,스노우피크 어패럴,실키 여성 스탠드넥 미들 다운 자켓 (S24WWTDJ29) Black,265050,5,29,0,169,0,black,20241127
4610881,노스페이스,NJ1DQ50K 화이트라벨 노벨티 눕시 에어 RDS 다운 자켓_BROWN,398000,0,93,0,170,0,brown | 화이트,20241127
4328141,노스페이스,NJ3BQ51J 화이트라벨 닐턴 자켓_BLACK,158390,20,60,0,171,0,black | 화이트,20241127
4569017,코오롱스포츠,남성 다운 안타티카 JWJDW24221GRY,790000,0,0,0,172,0,,20241127
4369456,테슬라,러닝 기모 타이즈 레깅스,23840,20,28,0,173,0,,20241127
4292340,말본 골프,트레일 WHITE,390000,0,10,0,174,0,white,20241127
4427591,데상트,2024 숏 캐논 덕다운 라이트 그레이(SP323SDJ92),389000,0,13,0,175,0,그레이,20241127
4604334,노스페이스,NJ4FQ58A 카라반 EX 플리스 자켓_BLACK,103200,20,145,0,176,0,black,20241127
4423717,에이치덱스,챔프스 스트레이트 스웨트 팬츠 (Black),63700,25,105,0,177,0,black,20241127
4589769,노스페이스,NJ3NQ57A 남성 지오돔 V 후디_BLACK,153290,30,41,0,178,0,black,20241127
4286950,노스페이스,NJ4FQ50K 화이트라벨 컴피 알파 플리스 집업_CREAM,108000,0,294,0,179,0,화이트,20241127
4472624,스노우피크 어패럴,[에디션] 캠픽 후드 헤비 다운 자켓 (S24WMKDJ24) Dark Gray,379050,5,22,0,180,0,,20241127
4528979,데상트,[SWISS SKI] 모노 크롬 와펜 스탠드넥 다운 자켓 글로시 블랙(SP423SDJO7),379000,0,16,0,181,0,블랙,20241127
4478554,나이키,써마 핏 ADV 리펠 다운 러닝 베스트 M - 블랙 / FB7543-010,188100,10,79,0,182,0,블랙,20241127
4595875,본투윈,FLEECE CAMO HOODIE ZIP-UP [BLACK],125000,10,40,0,183,0,black,20241127
4579106,노스페이스,NJ3GQ52A 유니 플리스 글러브_BLACK,38690,10,101,0,184,0,black,20241127
4520728,에이치덱스,우먼스 서포트 웜업 부츠컷 레깅스 (Black),50400,10,20,0,185,0,black,20241127
4165643,무신사 스탠다드 스포츠,[힛탠스] 웜 파워스트레치 글러브 [블랙],19900,0,140,0,186,0,블랙,20241127
4507188,스노우피크 어패럴,시티캠퍼 유틸리티 후드 다운 자켓 (S24WMGDJ68) Black,369000,16,29,0,187,0,black,20241127
4576931,씨큐알,아웃도어 방한 그리드 플리스 자켓,48860,30,75,0,188,0,,20241127
4548931,노스페이스,NJ1DQ85K 화이트라벨 여성 노벨티 눕시 RDS 다운 자켓_WHITE,368000,0,271,0,189,0,white | 화이트,20241127
4382322,제이엘브,원턱 헤비코튼 라인 와이드 팬츠,49000,42,27,0,190,0,,20241127
4251385,본투윈,STROKE B TANK TOP [WHITE],58000,16,11,0,191,0,white,20241127
4251056,본투윈,STROKE B BOOTS CUT LEGGINGS [GREY],58000,16,26,0,192,0,grey,20241127
4523373,무신사 스탠다드 스포츠,[유러피안 구스] 라이트쉘 다운 자켓(2color),239920,20,130,0,193,0,,20241127
4306353,무신사 스탠다드 스포츠,아이언 히트 다운 자켓 (5color),87945,45,413,0,194,0,,20241127
4148430,본투윈,BRN MUSCLE FIT HALF ZIP-UP LONGSLEEVE [WHITE],71000,20,0,0,195,0,white,20241127
4525863,뉴에라,AP MLB LOGO STADIUM JK43 LOSDOD D BLU,139300,30,67,0,196,0,,20241127
4451407,디스커버리 익스페디션,여성 올리아 글로우 다운 (N/CREAM),279000,0,250,0,197,0,,20241127
4470672,디스커버리 익스페디션,반슬리 고프코어 다운 (BEIGE2),279000,0,11,0,198,0,,20241127
4483244,말본 골프,튜브 스윙 다운자켓 BLACK (MAN),699000,0,0,0,199,0,black,20241127
4608445,노스페이스,NS99Q56A 여성 캠프 부띠 숏/BLK,139000,0,17,0,200,0,,20241127
4421406,아디다스,에센셜 짐 색 HT4740,8840,48,73,0,201,0,,20241127
4518105,노스페이스,NJ2GQ50F 남성 에코 고어텍스 마운틴 자켓,343190,20,14,0,202,0,,20241127
4578114,이미스,LOGO JACQUARD EAR MUFF (RENEWAL)-BLACK,39000,0,47,0,203,0,black,20241127
4298724,나인제트,시그니처 모크넥 머슬핏 긴팔 티셔츠 (화이트) NSTL03,33750,25,17,0,204,0,화이트,20241127
4604442,노스페이스,NJ3NQ83B 여성 눕시 온볼 자켓_ICE GRAY,224090,10,401,0,205,0,,20241127
4259554,남양유업,테이크핏 맥스 곡물맛 250ml 24입,32320,20,10,0,206,0,,20241127
4630190,내셔널지오그래픽,N227UFT420 브레디 니트 경량 다운 자켓 BLACK,90000,55,53,0,207,0,black,20241127
4517352,노스페이스,NV1DQ57C 남성 슈퍼플렉스 눕시 다운 베스트 (RDS)_CREAM,260100,10,14,0,208,0,,20241127
4457292,노르디스크,유니 알페임 퀼팅 후디 자켓_OATMEAL,259000,0,0,0,209,0,,20241127
4357008,아디다스,슈퍼노바 프리마 IE5968,129350,35,10,0,210,0,,20241127
4544499,노스페이스,NJ3NQ80B 여성 뉴 퍼피 EX 온볼 자켓_COCOA BROWN,224090,10,125,0,211,0,brown,20241127
4365752,마리떼 무브망,MOUVEMENT W SAILOR COLLAR KNIT CARDIGAN melange gray,127200,20,17,0,212,0,,20241127
4287132,노스페이스,NJ1DQ80C 여성 1996 레트로 눕시 자켓_GRAYISH LILAC,319200,20,44,0,213,0,,20241127
3476752,디스커버리 익스페디션,남성 픽시버G U넥 튜브 구스다운 경량패딩 (BLACK),159000,0,15,0,214,0,black,20241127
4340586,토런스,파이핑 트랙 스포티 자켓,84000,40,25,0,215,0,,20241127
4527683,스노우피크 어패럴,카라 부클넥 헤비 다운 자켓 (S24WMGDJ56) Black,312550,5,38,0,216,0,black,20241127
4479677,레이버코,RAVER FLAG 올드앤더티 후디 차콜,62300,30,11,0,217,0,차콜,20241127
4602452,아크테릭스,베타 자켓 남성 - BLACK SAPPHIRE / AJOFMX8584,617500,5,27,0,218,0,black,20241127
4273705,아디다스,맨체스터 유나이티드 24/25 긴팔 홈 저지 IT1971,67080,48,51,0,219,0,,20241127
4526711,케이투,시그니처 고스트(GHOST) 윈드스토퍼 다운_URBAN KHAKI,599000,18,0,0,220,0,,20241127
4630517,노스페이스,NJ1DQ54J 화이트라벨 퀀텀 엘버런 RDS 다운 자켓_BLACK,598000,0,24,0,221,0,black | 화이트,20241127
4475117,썬러브,Toray Slice Down Jacket Black,295200,20,15,0,222,0,black,20241127
4439755,노스페이스,NJ1DQ85N 화이트라벨 여성 노벨티 눕시 RDS 다운 자켓_VIOLET,294390,20,99,0,223,0,화이트,20241127
4421121,아크테릭스,프로톤 헤비웨이트 후디 남성 - STRATUS / AJOFMX7398,589000,5,0,0,224,0,,20241127
3894116,에이치덱스,바시티 숏 슬리브,33100,15,25,0,225,0,,20241127
4251421,본투윈,STROKE B TANK TOP [BLACK],58000,16,15,0,226,0,black,20241127
4456841,노스페이스,NJ1DQ95A 남자 히말라얀 30주년 기념 파카,579000,0,12,0,227,0,,20241127
4586885,빈트릴,히든 후드 다이애그널 헤비 다운 패딩(블랙),229600,30,0,0,228,0,블랙,20241127
4329639,에이치덱스,컬러 블럭 파이핑 웜업 풀오버 (White),75600,15,13,0,229,0,white,20241127
4479929,디스커버리 익스페디션,여성 켈리 구스다운 롱패딩 (LAVENDER),570000,0,16,0,230,0,,20241127
